{
  "project": "Snipvault",
  "tagline": "A code-snippet manager with team sharing — illustrative sample, fictional project",
  "date": "2026-07-04",
  "sample": true,
  "constraints": [
    "Solo developer, ~8 hours/week",
    "Prototype built; no users yet",
    "Stated goal: turn it into a paid product"
  ],
  "factBase": [
    {
      "fact": "Snippet management is a crowded category: GitHub Gists is free and ubiquitous; multiple paid incumbents exist in the $5-10/user/mo range",
      "source": "illustrative example"
    },
    {
      "fact": "Modern editors and AI assistants generate snippets on demand, shrinking the reuse problem the category was built on",
      "source": "illustrative example"
    },
    {
      "fact": "No incumbent has meaningful team-permission workflows for snippets",
      "source": "illustrative example — claimed white space"
    }
  ],
  "members": [
    {
      "seat": 1,
      "role": "CTO",
      "title": "Technical defensibility & maintenance reality",
      "vote": "SHELVE",
      "argument": "Nothing here is defensible: a snippet CRUD with sharing is a weekend build for any incumbent, and the claimed white space (team permissions) is a sprint, not a moat. The hidden burden is sync and editor-plugin maintenance across VS Code, JetBrains, and vim — a permanent tax that has ground down better-funded teams in this exact category.",
      "keyNumber": "~1 sprint for an incumbent to copy the differentiator",
      "flipCondition": "A technical wedge incumbents structurally can't follow — none is currently proposed",
      "action": "Before writing more code, list what the incumbents' changelogs shipped in the last year; if team features appear, this is over",
      "reactsTo": null,
      "fullAssessment": "## Framing\nI restate the case as: \"should a solo builder spend further weekends on a snippet manager whose differentiator is team sharing?\" The alternative framing — \"is there any technically defensible product in the snippet space at all?\" — matters, because my answer to the second drives the first.\n\n## Analysis\nThe build is a CRUD store, a share/permission layer, and editor plugins. None of it is novel; the permission layer the pitch calls white space is a bounded feature any incumbent ships in one sprint, because the data model (snippet → owner → grantees) is trivial. The genuinely hard part is the one the pitch ignores: editor-plugin maintenance. VS Code, JetBrains, and vim move on independent release cadences; every breakage is a support ticket, and plugin rot is the documented killer of small tools in this category.\n\n## Evidence & assumptions\nFacts: incumbents exist at $5–10/user/mo; GitHub Gists is free (fact base). ESTIMATE: 1 sprint for an incumbent to replicate team permissions — based on the data model's simplicity, not on any incumbent's roadmap. ESTIMATE: plugin maintenance ≈ 2–4 hrs/week once three editors are supported.\n\n## Risks\n1. **Plugin rot** (high): permanent tax that grows with adoption. 2. **Instant copyability** (high): success invites a one-sprint clone. 3. **Sync conflicts** (medium): the first team feature request will be offline sync — a hard problem for no strategic gain.\n\n## What would change my mind\nA wedge incumbents structurally can't follow: e.g., deep integration with a proprietary internal toolchain, or a compliance/governance angle (see CFO). Watch for: incumbents' changelogs shipping team features (kill signal), or enterprise snippet-governance RFPs appearing (revive signal).\n\n## Recommendations\n1. Before any further code, audit the top three incumbents' last 12 months of changelogs; if team features shipped, stop.\n2. If continuing at all, support ONE editor and refuse the other plugins.\n3. Cap total future investment at one weekend (see CEO) and treat the codebase as a portfolio artifact: polish the README over the features."
    },
    {
      "seat": 2,
      "role": "CFO",
      "title": "Unit economics",
      "vote": "SHELVE",
      "argument": "I agree with the CTO and add the demand-side problem: the price ceiling is anchored by a free incumbent, so realistic ARPU is $5/mo against a shrinking problem. At plausible conversion, reaching even $1K MRR needs thousands of active users acquired in a category with no organic search growth. The hours are worth more elsewhere.",
      "keyNumber": "$5/mo ceiling × shrinking problem = math that never closes",
      "flipCondition": "Evidence of teams paying for snippet governance today (procurement, compliance) — a different buyer than developers",
      "action": "Spend one evening searching for that buyer before spending another on the code",
      "reactsTo": "Agrees with CTO; adds that even uncopied, the demand math fails",
      "fullAssessment": "## Framing\nRestated: \"can this reach meaningful revenue inside this builder's constraint envelope?\" Alternative framing — \"is there any buyer for whom snippets are a budget line?\" — is the only version with a non-obvious answer.\n\n## Analysis\nPrice is anchored by a free incumbent (Gists), so realistic ARPU sits at the bottom of the $5–10 band; call it $5/mo blended. $1K MRR therefore needs ~200 paying users; at a 2% free-to-paid conversion that implies ~10,000 actives — in a category with flat-to-declining organic demand, acquired by a solo builder at 8 hrs/week. The months-to-milestone math does not close under any honest assumption. The one exception worth naming: compliance. If any regulated team must govern what code fragments employees share (audit trails, retention), \"snippet governance\" becomes a procurement item at 10–20× the consumer price. I found no evidence this buyer exists; I also can't rule it out from the fact base.\n\n## Evidence & assumptions\nFacts: competitor pricing $5–10/user/mo (fact base). ESTIMATES, all flagged: 2% conversion (industry-typical for OSS-adjacent tools), $5 blended ARPU, 10K actives required. No demand-side data exists in either direction — that absence is itself the finding.\n\n## Risks\n1. **Zero-price anchor** (high): the free incumbent caps willingness to pay permanently. 2. **Shrinking demand** (high): AI assistants dissolve the reuse habit. 3. **Opportunity cost** (high): these are the builder's only 8 hours.\n\n## What would change my mind\nOne procurement-driven buyer: a compliance officer, not a developer, asking for snippet governance. Watch: RFPs, SOC2 tooling lists, security-team forums.\n\n## Recommendations\n1. Spend one evening — not one sprint — searching for the compliance buyer (security forums, RFP databases).\n2. If not found, stop all revenue framing; reclassify as portfolio work.\n3. Never build billing for this."
    },
    {
      "seat": 3,
      "role": "VC",
      "title": "Venture shape",
      "vote": "SHELVE",
      "argument": "Feature, not company — and a feature of a category whose core problem is being dissolved by AI-generated code. The market isn't just crowded; it's evaporating. Timing is the strongest argument against, not competition.",
      "keyNumber": "TAM derivative: negative",
      "flipCondition": "None within this framing; a pivot to AI-context management would be a different council",
      "action": "If the itch is real, reframe around what AI assistants need (context, not snippets) and re-run the council on that",
      "reactsTo": "Extends CFO: the demand problem is structural, not just quantitative",
      "fullAssessment": "## Framing\nRestated: \"is this venture-shaped?\" The alternative framing the builder should sit with: \"what is the terminal size of the best possible outcome?\" — because for this idea, even flawless execution lands small.\n\n## Analysis\nClassification: feature, not company — and a feature of a dissolving category. The core behavior (file a snippet, retrieve it later) is being replaced by a superior substitute: asking an AI assistant, which regenerates the pattern with current context instead of retrieving a stale one. When the substitute is better AND lower-friction, the category doesn't shrink, it evaporates. Timing is therefore the strongest argument against — stronger than competition. The Gists-anchored pricing (CFO) and one-sprint copyability (CTO) are secondary: they describe why winning would be hard; the timing describes why winning would be worthless.\n\n## Evidence & assumptions\nFacts: crowded category, free incumbent, AI-generation trend (fact base). ESTIMATE: category demand trajectory is negative — inferred from substitution logic, not measured; I flag that no seat has usage data, and the ICP's lived behavior (below) is our only demand observation.\n\n## Risks\nFor a hypothetical investor: total — no moat, no growth market, no team leverage. For the builder: only opportunity cost, which the CEO must price.\n\n## What would change my mind\nNothing within this framing. A pivot to what AI assistants actually need — context management, prompt/pattern libraries with team governance — would be a different company in a growing category, and I would want that council run.\n\n## Recommendations\n1. Do not raise, do not bootstrap, do not extend this framing.\n2. Extract the reusable asset: the team-sharing/permissions code is a fine module for a future product.\n3. If the itch persists, re-run the council on the AI-context-management reframing within 30 days — while the interest is warm."
    },
    {
      "seat": 4,
      "role": "CMO",
      "title": "Distribution & positioning",
      "vote": "SHIP_AND_SEE",
      "argument": "I partially dissent: the deliberation is right about the business, but a polished OSS release costs one weekend and buys a portfolio piece plus list-building in dev communities. Distribution channels exist (r/webdev, HN) even if the paid path doesn't. Ship it as a gift, measure nothing but reach.",
      "keyNumber": "1 weekend to a shippable OSS release",